Gene,ORF,UniprotID,Protein description,SNson/PELson       (average)         ,SNcarb/PELcarb  (average)          ,Yeast / Mito,Soluble,Peripheral,Integral,Ambiguous,L sol,L per,L int,Outer membrane,Inner membrane,Inter-membrane space,Matrix,,,,max
RHO5,YNL180C,P53879,Non-essential small GTPase of the Rho/Rac family of Ras-like proteins; regulated by phosphorylation and ubiquitination; likely involved in protein kinase C (Pkc1p)-dependent signal transduction pathway that controls cell integrity,0.84,1.38,2.57,,,X,,0,0,0.6,,X,,,,,,60%
RIB3,YDR487C,Q99258,"3,4-dihydroxy-2-butanone-4-phosphate synthase (DHBP synthase); required for riboflavin biosynthesis from ribulose-5-phosphate, also has an unrelated function in mitochondrial respiration",4.36,--,##,X,,,,0,0,0,,,X,,,,,0%
RIB4,YOL143C,P50861,"Lumazine synthase (DMRL synthase); catalyzes synthesis of immediate precursor to riboflavin; DMRL synthase stands for 6,7-dimethyl-8-ribityllumazine synthase",2.24,20.00**,76.13,X,,,,0,0,0,,,X,,,,,0%
RIM1,YCR028C-A,P32445,ssDNA-binding protein essential for mitochondrial genome maintenance; involved in mitochondrial DNA replication,24.22,20.45,0.69,X,,,,0.96,0,0,,,,X,,,,96%
RIM2,YBR192W,P38127,Mitochondrial pyrimidine nucleotide transporter; imports pyrimidine nucleoside triphosphates and exports pyrimidine nucleoside monophosphates; member of the mitochondrial carrier family,0.2,0.09,0.21,,,X,,0,0,0.94,,X,,,,,,94%
RIP1,YEL024W,P08067,"Ubiquinol-cytochrome-c reductase; a Rieske iron-sulfur protein of the mitochondrial cytochrome bc1 complex; transfers electrons from ubiquinol to cytochrome c1 during respiration; during import, Rip1p is first imported into the mitochondrial matrix where it is processed, acquires its Fe-S cluster, and is folded, then is translocated into the inner membrane by the action of a homo-oligomer of Bcs1p, and finally is delivered by Bcs1p to Complex III for assembly",0.36,22.94,0.19,,X,,,0,0.75,0,,X,,,,,,75%
RMD9,YGL107C,P53140,"Mitochondrial protein required for respiratory growth; mutant phenotype and genetic interactions suggest a role in delivering mt mRNAs to ribosomes; located on matrix face of the inner membrane and loosely associated with mitoribosomes; RMD9 has a paralog, YBR238C, that arose from the whole genome duplication",0.53,16.24,0.12,,X,,,0,0.95,0,,X,,,,,,95%
RML2,YEL050C,P32611,"Mitochondrial ribosomal protein of the large subunit (L2); has similarity to E. coli L2 ribosomal protein; mutant allele (fat21) causes inability to utilize oleate, and induce oleic acid oxidation; may interfere with activity of the Adr1p transcription factor",1.14,0.81,0.25,,,,X,0,0,0.3,,,,,,,,30%
RPL10,YLR075W,P41805,Ribosomal 60S subunit protein L10; responsible for joining the 40S and 60S subunits; regulates translation initiation; similar to members of the QM gene family; homologous to mammalian ribosomal protein L10 and bacterial L16; protein abundance increases in response to DNA replication stress; mutations in the human ortholog are associated with development of T-cell acute lymphoblastic leukemia and similar changes in the yeast gene result in ribosome biogenesis defects,0.35,2.43,31.11,,,X,,0,0.18,0.66,,X,,,,,,66%
RPL25,YOL127W,P04456,Ribosomal 60S subunit protein L25; primary rRNA-binding ribosomal protein component of large ribosomal subunit; binds to 25S rRNA via a conserved C-terminal motif; homologous to mammalian ribosomal protein L23A and bacterial L23,0.96,3.75,73.03,,,,X,0,0.6,0.07,,,,,,,,60%
RPL38,YLR325C,P49167,"Ribosomal 60S subunit protein L38; homologous to mammalian ribosomal protein L38, no bacterial homolog",5.46,9,17.4,X,,,,0.89,0.02,0,,,,X,,,,89%
RPM2,YML091C,Q02773,"Protein subunit of mitochondrial RNase P; has roles in nuclear transcription, cytoplasmic and mitochondrial RNA processing, and mitochondrial translation; distributed to mitochondria, cytoplasmic processing bodies, and the nucleus",0.2,3.4,0,,X,,,0,0.68,0.14,,X,,,,,,68%
RPO41,YFL036W,P13433,"Mitochondrial RNA polymerase; single subunit enzyme similar to those of T3 and T7 bacteriophages; requires a specificity subunit encoded by MTF1 for promoter recognition; Mtf1p interacts with and stabilizes the Rpo41p-promoter complex, enhancing DNA bending and melting to facilitate pre-initiation open complex formation",0.46,3.89,0.03,,X,,,0,0.71,0.17,,X,,,,,,71%
RPP2A,YOL039W,P05319,"Ribosomal protein P2 alpha; a component of the ribosomal stalk, which is involved in the interaction between translational elongation factors and the ribosome; free (non-ribosomal) P2 stimulates the phosphorylation of the eIF2 alpha subunit (Sui2p) by Gcn2p; regulates the accumulation of P1 (Rpp1Ap and Rpp1Bp) in the cytoplasm",1.77,2.82,4.35,,,,X,0,0.04,0.01,,,,,,,,4%
RPS13,YDR064W,P05756,Protein component of the small (40S) ribosomal subunit; homologous to mammalian ribosomal protein S13 and bacterial S15,0.38,0.98,14.53,,,X,,0,0,0.94,,X,,,,,,94%
RPS20,YHL015W,P38701,Protein component of the small (40S) ribosomal subunit; overproduction suppresses mutations affecting RNA polymerase III-dependent transcription; homologous to mammalian ribosomal protein S20 and bacterial S10,0.89,3.96,69.73,,,,X,0,0.68,0.06,,,,,,,,68%
RPS29B,YDL061C,P41058,"Protein component of the small (40S) ribosomal subunit; homologous to mammalian ribosomal protein S29 and bacterial S14; RPS29B has a paralog, RPS29A, that arose from the whole genome duplication",4.12,0.16,11.57,,,,X,0,0,0,,,,,,,,0%
RPS3,YNL178W,P05750,Protein component of the small (40S) ribosomal subunit; has apurinic/apyrimidinic (AP) endonuclease activity; essential for viability; homologous to mammalian ribosomal protein S3 and bacterial S3,0.38,3.42,13.81,,,,X,0,0.58,0.28,,,,,,,,58%
RPS5,YJR123W,P26783,Protein component of the small (40S) ribosomal subunit; least basic of non-acidic ribosomal proteins; phosphorylated in vivo; essential for viability; homologous to mammalian ribosomal protein S5 and bacterial S7,0.34,1.25,##,,,X,,0,0,0.92,,X,,,,,,92%
RRF1,YHR038W,P38771,Mitochondrial ribosome recycling factor; essential for mitochondrial protein synthesis and for the maintenance of the respiratory function of mitochondria,10.09,14.97,0.47,X,,,,0.98,0,0,,,,X,,,,98%
RRG1,YDR065W,Q12167,"Protein of unknown function; required for vacuolar acidification and mitochondrial genome maintenance; the authentic, non-tagged protein is detected in highly purified mitochondria in high-throughput studies",0.31,3.88,0,,X,,,0,0.73,0.16,,X,,,,,,73%
RRG7,YOR305W,Q08774,Protein of unknown function; green fluorescent protein (GFP)-fusion protein localizes to the mitochondrion; deletion confers sensitivity to 4-(N-(S-glutathionylacetyl)amino) phenylarsenoxide (GSAO); YOR305W is not an essential gene,0.3,4.22,0.12,,X,,,0,0.79,0.11,,X,,,,,,79%
RRG8,YPR116W,Q06109,Putative protein of unknown function; required for mitochondrial genome maintenance; null mutation results in a decrease in plasma membrane electron transport,0.94,8.31,0,,X,,,0,0.96,0,,X,,,,,,96%
RRG9,YNL213C,P40156,"Protein of unknown function; null mutant lacks mitochondrial DNA and cannot grow on glycerol; the authentic, non-tagged protein is detected in highly purified mitochondria in high-throughput studies",12.86,4.08,0.53,,,,X,0.04,0,0,,,,,,,,4%
RSM10,YDR041W,Q03201,"Mitochondrial ribosomal protein of the small subunit; has similarity to E. coli S10 ribosomal protein; essential for viability, unlike most other mitoribosomal proteins",1.31,15.09,0.23,,X,,,0,0.97,0,,X,,,,,,97%
RSM18,YER050C,P40033,Mitochondrial ribosomal protein of the small subunit; has similarity to E. coli S18 ribosomal protein,2.98,18.64,0.57,X,,,,0.3,0.65,0,,,,X,,,,65%
RSM19,YNR037C,P53733,Mitochondrial ribosomal protein of the small subunit; has similarity to E. coli S19 ribosomal protein,7.41,26.75,0.48,X,,,,0.93,0.05,0,,,,X,,,,93%
RSM22,YKL155C,P36056,Mitochondrial ribosomal protein of the small subunit; also predicted to be an S-adenosylmethionine-dependent RNA methyltransferase,1.31,5.13,0.07,,X,,,0,0.77,0,,X,,,,,,77%
RSM23,YGL129C,Q01163,Mitochondrial ribosomal protein of the small subunit; has similarity to mammalian apoptosis mediator proteins; null mutation prevents induction of apoptosis by overproduction of metacaspase Mca1p,1.1,16.91,0.2,,X,,,0,0.97,0,,X,,,,,,97%
RSM24,YDR175C,Q03976,Mitochondrial ribosomal protein of the small subunit,3.55,14.17,0.32,X,,,,0.62,0.32,0,,,,X,,,,62%
RSM25,YIL093C,P40496,Mitochondrial ribosomal protein of the small subunit,3.45,14.06,0.16,X,,,,0.59,0.35,0,,,,X,,,,59%
RSM26,YJR101W,P47141,Mitochondrial ribosomal protein of the small subunit,1.73,12.42,0,,X,,,0.02,0.94,0,,X,,,,,,94%
RSM27,YGR215W,P53305,Mitochondrial ribosomal protein of the small subunit,4.24,14.7,0.11,X,,,,0.81,0.15,0,,,,X,,,,81%
RSM28,YDR494W,Q03430,Mitochondrial ribosomal protein of the small subunit; genetic interactions suggest a possible role in promoting translation initiation,2.87,12.04,0.21,,,X,,0.34,0.58,0,,X,,,,,,58%
RSM7,YJR113C,P47150,Mitochondrial ribosomal protein of the small subunit; has similarity to E. coli S7 ribosomal protein,2.61,4.57,0.39,,,,X,0.02,0.15,0,,,,,,,,15%
RSP5,YER125W,P39940,"E3 ubiquitin ligase of NEDD4 family; regulates many cellular processes including MVB sorting, heat shock response, transcription, endocytosis, ribosome stability; mutant tolerates aneuploidy; autoubiquitinates; ubiquitinates Sec23p and Sna3p; deubiquitinated by Ubp2p; activity regulated by SUMO ligase Siz1p, in turn regulates Siz1p SUMO ligase activity; required for efficient Golgi-to-ER trafficking in COPI mutants; human homolog implicated in Liddle syndrome",1.45,6.01,15.92,,X,,,0,0.83,0,,X,,,,,,83%
RSR1,YGR152C,P13856,"GTP-binding protein of the Ras superfamily; required for bud site selection, morphological changes in response to mating pheromone, and efficient cell fusion; localized to the plasma membrane; significantly similar to mammalian Rap GTPases",0.44,2.27,0.2,,,X,,0,0.1,0.73,,X,,,,,,73%
RTC6,YPL183W-A,O14464,"Protein involved in translation; mutants have defects in biogenesis of nuclear ribosomes; sequence similar to prokaryotic ribosomal protein L36, may be a mitochondrial ribosomal protein; protein abundance increases in response to DNA replication stress",1.67,11.02,0,,X,,,0.02,0.94,0,,X,,,,,,94%
RTN1,YDR233C,Q04947,"Reticulon protein; stabilizes membrane curvature; involved in nuclear pore assembly and maintenance of tubular ER morphology; mutant overexpressing RTN1 shows increase in tubular ER; interacts with exocyst subunit Sec6p, Yip3p, and Sbh1p; more abundant than Rtn2p; member of the RTNLA subfamily; mutants have reduced phosphatidylserine transfer between the ER and mitochondria; RTN1 has a paralog, RTN2, that arose from the whole genome duplication",0.37,0.71,5.94,,,X,,0,0,0.95,,X,,,,,,95%
RTN2,YDL204W,Q12443,"Reticulon protein; stabilizes membrane curvature; involved in nuclear pore assembly and maintenance of tubular ER morphology; interacts with exocyst subunit Sec6p, Yip3p, and Sbh1p; much less abundant than Rtn1p; rtn1 rtn2 yop1 triple mutant lacks tubular ER; member of RTNLA (reticulon-like A) subfamily; protein increases in abundance and relocalizes to plasma membrane upon DNA replication stress; RTN2 has a paralog, RTN1, that arose from the whole genome duplication",0.51,0.96,43.43,,,X,,0,0,0.92,,X,,,,,,92%
SAC1,YKL212W,P32368,"Phosphatidylinositol phosphate (PtdInsP) phosphatase; involved in hydrolysis of PtdIns[4]P in the early and medial Golgi; regulated by interaction with Vps74p; ER localized transmembrane protein which cycles through the Golgi; involved in protein trafficking and processing, secretion, and cell wall maintenance; regulates sphingolipid biosynthesis through the modulation of PtdIns(4)P metabolism",0.39,0.36,2.21,,,X,,0,0,0.97,X,,,,,,,97%
SAM35,YHR083W,P14693,Component of the sorting and assembly machinery (SAM) complex; the SAM (or TOB) complex is located in the mitochondrial outer membrane; the complex binds precursors of beta-barrel proteins and facilitates their insertion into the outer membrane,0.38,12.47,0.15,,X,,,0,0.94,0,X,,,,,,,94%
SAM37,YMR060C,P50110,Component of the Sorting and Assembly Machinery (SAM) complex; the SAM (or TOB) complex is located in the mitochondrial outer membrane; binds precursors of beta-barrel proteins and facilitates their outer membrane insertion; contributes to SAM complex stability,0.41,23.84,0.15,,X,,,0,0.78,0,X,,,,,,,78%
SAM50,YNL026W,P53969,Component of the Sorting and Assembly Machinery (SAM) complex; the SAM (or TOB) complex is located in the mitochondrial outer membrane; the complex binds precursors of beta-barrel proteins and facilitates their outer membrane insertion; homologous to bacterial Omp85,0.25,0.27,0.12,,,X,,0,0,0.97,X,,,,,,,97%
SAR1,YPL218W,P20606,"GTPase, GTP-binding protein of the ARF family; component of COPII coat of vesicles; required for transport vesicle formation during ER to Golgi protein transport; lowers membrane rigidity helping in vesicle formation",0.53,1.81,4.42,,,X,,0,0.02,0.81,,X,,,,,,81%
SCEI,Q0160,P03882,I-SceI DNA endonuclease; encoded by the mitochondrial group I intron of the 21S_rRNA gene; mediates gene conversion that propagates the intron into intron-less copies of the 21S_rRNA gene,0.14,0.03,##,,,X,,0,0,0.67,,X,,,,,,67%
SCM4,YGR049W,P32564,"Mitochondrial outer membrane protein of unknown function; predicted to have 4 transmembrane segments; import is mediated by Tom70p and Mim1p; interacts genetically with a cdc4 mutation; SCM4 has a paralog, ATG33, that arose from the whole genome duplication",0.32,2.6,0.57,,,X,,0,0.27,0.56,X,,,,,,,56%
SCO1,YBR037C,P23833,"Copper-binding protein of mitochondrial inner membrane; required for cytochrome c oxidase activity and respiration; may function to deliver copper to cytochrome c oxidase; similar to thioredoxins; SCO1 has a paralog, SCO2, that arose from the whole genome duplication",0.26,0.41,0.37,,,X,,0,0,0.96,,X,,,,,,96%
SCO2,YBR024W,P38072,"Protein anchored to mitochondrial inner membrane; may have a redundant function with Sco1p in delivery of copper to cytochrome c oxidase; interacts with Cox2p; SCO2 has a paralog, SCO1, that arose from the whole genome duplication",0.26,0.38,0.37,,,X,,0,0,0.96,,X,,,,,,96%
SCS2,YER120W,P40075,"Integral ER membrane protein, regulates phospholipid metabolism; one of 6 proteins (Ist2p, Scs2p, Scs22p, Tcb1p, Tcb2p, Tcb3p) that connect ER to the plasma membrane (PM) and regulate PI4P levels by controlling access of Sac1p phosphatase to its substrate PI4P in the PM; interacts with FFAT motif of Opi1p; involved in telomeric silencing; null shows inositol auxotrophy above 34 deg C; VAP homolog; SCS2 has a paralog, SCS22, that arose from the whole genome duplication",0.47,0.48,2.3,,,X,,0,0,0.95,X,,,,,,,95%
SCW4,YGR279C,P53334,"Cell wall protein with similarity to glucanases; scw4 scw10 double mutants exhibit defects in mating; SCW4 has a paralog, SCW10, that arose from the whole genome duplication",1.9,3.11,4.96,,,,X,0,0.05,0,,,,,,,,5%
SDH1,YKL148C,Q00711,"Flavoprotein subunit of succinate dehydrogenase; couples the oxidation of succinate to the transfer of electrons to ubiquinone as part of the TCA cycle and the mitochondrial respiratory chain; FAD binding to Sdh1p is required for the assembly of the succinate dehydrogenase subunits; SDH1 has a paralog, YJL045W, that arose from the whole genome duplication",2.54,21.39,0.32,,X,,,0.12,0.84,0,,X,,,,,,84%
SDH2,YLL041C,P21801,"Iron-sulfur protein subunit of succinate dehydrogenase; the complex couples the oxidation of succinate to the transfer of electrons to ubiquinone as part of the TCA cycle and the mitochondrial respiratory chain; other members are Sdh1p, Sdh3p, and Sdh4p",2.41,24.72,0.21,,X,,,0.07,0.89,0,,X,,,,,,89%
SDH3,YKL141W,P33421,"Subunit of succinate dehydrogenase and of TIM22 translocase; functions as cytochrome b subunit of succinate dehydrogenase, which couples oxidation of succinate to transfer of electrons to ubiquinone as part of the TCA cycle and the mitochondrial respiratory chain; also required for mitochondrial inner membrane protein import as part of the TIM22 complex; SDH3 has a paralog, SHH3, that arose from the whole genome duplication",0.36,0.04,0.17,,,X,,0,0,0.9,,X,,,,,,90%
SDH4,YDR178W,P37298,"Membrane anchor subunit of succinate dehydrogenase (SDH); involved in coupling the oxidation of succinate to the transfer of electrons to ubiquinone as part of the TCA cycle and the mitochondrial respiratory chain; has similarity to human SDH subunit D (SDHD), which is implicated in paraganglioma",0.3,1.83,0.16,,,X,,0,0.04,0.82,,X,,,,,,82%
SDH5,YOL071W,Q08230,"Protein required for flavinylation of Sdh1p; binds to Sdh1p and promotes FAD cofactor attachment, which is necessary for succinate dehydrogenase (SDH) complex assembly and activity; mutations in human ortholog PGL2 are associated with neuroendocrine tumors (paraganglioma)",14.84,16.94,0.65,X,,,,0.98,0,0,,,,X,,,,98%
SDH6,YDR379C-A,Q3E785,Mitochondrial protein involved in assembly of succinate dehydrogenase; has a role in maturation of the Sdh2p subunit; member of the LYR protein family; mutations in human ortholog SDHAF1 are associated with infantile leukoencephalopathy,8.61,17.02,0,X,,,,0.98,0,0,,,,X,,,,98%
SDH7,YDR511W,Q04401,Mitochondrial protein involved in assembly of succinate dehydrogenase; has a role in maturation of the Sdh2p subunit; localized to the mitochondrial intermembrane space; required for acetate utilization and gluconeogenesis; mutation in Drosophila ortholog SDHAF3 causes reduced succinate dehydrogenase activity and neuronal and muscular dysfunction; member of the LYR protein family,10.37,26.73,0.28,X,,,,0.97,0.01,0,,,,X,,,,97%
SDH8,YBR269C,P38345,"Protein required for assembly of succinate dehydrogenase; interacts with flavinylated Sdh1p and may function as a chaperone for free Sdh1p, protecting its FAD cofactor from redox reactions before assembly of the complex; soluble protein of the mitochondrial matrix; respiratory defect of null mutant is functionally complemented by Drosophila and human orthologs",21.08,28.54,1.31,X,,,,0.96,0,0,,,,X,,,,96%
SEC4,YFL005W,P07560,Rab family GTPase; essential for vesicle-mediated exocytic secretion and autophagy; associates with the exocyst component Sec15p and may regulate polarized delivery of transport vesicles to the exocyst at the plasma membrane,0.18,0.22,1.63,,,X,,0,0,0.94,X,,,,,,,94%
SEC63,YOR254C,P14906,"Essential subunit of Sec63 complex; with Sec61 complex, Kar2p/BiP and Lhs1p forms a channel competent for SRP-dependent and post-translational SRP-independent protein targeting and import into the ER; other members are Sec62p, Sec66p, and Sec72p",0.35,0.34,4.43,,,X,,0,0,0.97,X,,,,,,,97%
SEG1,YMR086W,Q04279,"Component of eisosome required for proper eisosome assembly; precedes Pil1p/Lsp1p during eisosome formation, controls eisosome length and shape; diffusely distributed, forms heterogeneous patches at plasma membrane in small buds, also found in medium and large buds; expression repressed by cAMP; similar to A. gossypii SEG gene and to S. pombe Sle1p, important for generating eisosomes; SEG1 has a paralog, SEG2, that arose from the whole genome duplication",6.89,3.32,4.75,,,,X,0.01,0,0,,,,,,,,1%
SEN2,YLR105C,P16658,"Subunit of the tRNA splicing endonuclease; tRNA splicing endonuclease is composed of Sen2p, Sen15p, Sen34p, and Sen54p; Sen2p contains the active site for tRNA 5' splice site cleavage and has similarity to Sen34p and to Archaeal tRNA splicing endonuclease",0.57,1.19,0,,,X,,0,0,0.87,X,,,,,,,87%
SEN34,YAR008W,P39707,"Subunit of the tRNA splicing endonuclease; tRNA splicing endonuclease is composed of Sen2p, Sen15p, Sen34p, and Sen54p; Sen34p contains the active site for tRNA 3' splice site cleavage and has similarity to Sen2p and to Archaeal tRNA splicing endonuclease",0.57,10.22,0.46,,X,,,0,0.97,0,X,,,,,,,97%
SEN54,YPL083C,Q02825,"Subunit of the tRNA splicing endonuclease; tRNA splicing endonuclease is composed of Sen2p, Sen15p, Sen34p, and Sen54p",0.22,3.41,0,,,X,,0,0.67,0.16,X,,,,,,,67%
SFC1,YJR095W,P33303,Mitochondrial succinate-fumarate transporter; transports succinate into and fumarate out of the mitochondrion; required for ethanol and acetate utilization,0.19,0.11,0.41,,,X,,0,0,0.94,,X,,,,,,94%
SFH5,YJL145W,P47008,"Non-classical phosphatidylinositol transfer protein (PITP); exhibits PI- but not PC-transfer activity; localizes to the peripheral endoplasmic reticulum, cytosol and microsomes; similar to Sec14p; partially relocalizes to the plasma membrane upon DNA replication stress",2.62,5.64,1.95,,,,X,0.07,0.34,0,,,,,,,,34%
SHE9,YDR393W,Q04172,Protein required for normal mitochondrial morphology; mitochondrial inner membrane protein; may be involved in fission of the inner membrane; forms a homo-oligomeric complex,0.26,0.38,0.64,,,X,,0,0,0.97,,X,,,,,,97%
SHH4,YLR164W,Q06236,"Putative alternate subunit of succinate dehydrogenase (SDH); mitochondrial inner membrane protein; genetic interaction with SDH4 suggests that Shh4p can function as a functional SDH subunit; a fraction copurifies with SDH subunit Sdh3p; expression induced by nitrogen limitation in a GLN3, GAT1-dependent manner; Shh4p has greater similarity to human SDHD (subunit D of SDH, implicated in paraganglioma) than does its paralog Sdh4p",0.24,0.29,1.73,,,X,,0,0,0.96,,X,,,,,,96%
SHM1,YBR263W,P37292,"Mitochondrial serine hydroxymethyltransferase; converts serine to glycine plus 5,10 methylenetetrahydrofolate; involved in generating precursors for purine, pyrimidine, amino acid, and lipid biosynthesis; reverse reaction generates serine",15.19,35.68,0.61,X,,,,0.93,0.01,0,,,,X,,,,93%
SHY1,YGR112W,P53266,Mitochondrial inner membrane protein required for complex IV assembly; associates with complex IV assembly intermediates and complex III/complex IV supercomplexes; similar to human SURF1 involved in Leigh Syndrome; complex IV is also known as cytochrome c oxidase,0.21,0.26,0.1,,,X,,0,0,0.96,,X,,,,,,96%
SIS1,YNL007C,P25294,Type II HSP40 co-chaperone that interacts with the HSP70 protein Ssa1p; shuttles between cytosol and nucleus; mediates delivery of misfolded proteins into the nucleus for degradation; involved in proteasomal degradation of misfolded cytosolic proteins; protein abundance increases in response to DNA replication stress; polyQ aggregates sequester Sis1p and interfere with clearance of misfolded proteins; similar to bacterial DnaJ proteins and mammalian DnaJB1,2.85,5.4,45.76,,,,X,0.08,0.22,0,,,,,,,,22%
SLC1,YDL052C,P33333,"1-acyl-sn-glycerol-3-phosphate acyltransferase; catalyzes the acylation of lysophosphatidic acid to form phosphatidic acid, a key intermediate in lipid metabolism; enzymatic activity detected in lipid particles and microsomes",1.09,1.81,1.72,,,,X,0,0.01,0.23,,,,,,,,23%
SLM1,YIL105C,P40485,"Phosphoinositide PI4,5P(2) binding protein, forms a complex with Slm2p; acts downstream of Mss4p in a pathway regulating actin cytoskeleton organization in response to stress; phosphorylated by the TORC2 complex; protein abundance increases in response to DNA replication stress; SLM1 has a paralog, SLM2, that arose from the whole genome duplication",0.47,10.6,2.77,,X,,,0,0.96,0,,X,,,,,,96%
SLM3,YDL033C,Q12093,tRNA-specific 2-thiouridylase; responsible for 2-thiolation of the wobble base of mitochondrial tRNAs; human ortholog is implicated in myoclonus epilepsy associated with ragged red fibers (MERRF),1.78,3.71,0.04,,,,X,0,0.19,0,,,,,,,,19%
SLM5,YCR024C,P25345,Mitochondrial asparaginyl-tRNA synthetase,3.15,13.57,0,X,,,,0.47,0.47,0,,,,X,,,,47%
SLN1,YIL147C,P39928,"Transmembrane histidine phosphotransfer kinase and osmosensor; regulates MAP kinase cascade; transmembrane protein with an intracellular kinase domain that signals to Ypd1p and Ssk1p, thereby forming a phosphorelay system similar to bacterial two-component regulators",0.49,0.48,0,,,X,,0,0,0.95,,X,,,,,,95%
SLS1,YLR139C,P42900,Mitochondrial membrane protein; coordinates expression of mitochondrially-encoded genes; may facilitate delivery of mRNA to membrane-bound translation machinery,0.43,9.06,0.16,,X,,,0,0.96,0.01,,X,,,,,,96%
SMM1,YNR015W,P53720,"Dihydrouridine synthase; member of a family of dihydrouridine synthases including Dus1p, Smm1p, Dus3p, and Dus4p; modifies uridine residues at position 20 of cytoplasmic tRNAs",3.85,7.11,0.07,X,,,,0.53,0.13,0,,,,X,,,,53%
SNL1,YIL016W,P40548,Ribosome-associated protein; proposed to act in protein synthesis and nuclear pore complex biogenesis and maintenance as well as protein folding; has similarity to the mammalian BAG-1 protein,0.39,0.05**,0.99,,,X,,0,0,0,,X,,,,,,0%
SNU13,YEL026W,P39990,"RNA binding protein; part of U3 snoRNP involved in rRNA processing, part of U4/U6-U5 tri-snRNP involved in mRNA splicing, similar to human 15.5K protein",1.34,20.3,0,,X,,,0,0.97,0,,X,,,,,,97%
SOD1,YJR104C,P00445,Cytosolic copper-zinc superoxide dismutase; detoxifies superoxide; stabilizes Yck1p and Yck2p kinases in glucose to repress respiration; phosphorylated by Dun1p and enters the nucleus under oxidative stress to promote transcription of stress response genes; human ortholog implicated in ALS; abundance increases under DNA replication stress and during exposure to boric acid; localization of a fraction to the mitochondrial intermembrane space is modulated by the MICOS complex,16.46,17.59,16.63,X,,,,0.98,0,0,,,X,,,,,98%
SOD2,YHR008C,P00447,Mitochondrial manganese superoxide dismutase; protects cells against oxygen toxicity; phosphorylated,21.64,23.57,0.93,X,,,,0.97,0,0,,,,X,,,,97%
SOM1,YEL059C-A,Q05676,Subunit of the mitochondrial inner membrane peptidase (IMP); IMP is required for maturation of mitochondrial proteins of the intermembrane space; Som1p facilitates cleavage of a subset of substrates; contains twin cysteine-x9-cysteine motifs,0.35,0.54,0.07,,,X,,0,0,0.96,,X,,,,,,96%
SOV1,YMR066W,Q04748,Mitochondrial protein of unknown function,1.48,5.7,0.06,,X,,,0,0.79,0,,X,,,,,,79%
